[
 {
  "changedFields": [
   "lastModified"
  ],
  "date": "2026-10-30",
  "key": "0362481-2",
  "kind": "prh",
  "label": "Suomen Asuntohypopankki Oy",
  "type": "edited"
 },
 {
  "changedFields": [
   "lastModified",
   "names",
   "registeredEntries"
  ],
  "date": "2026-10-30",
  "key": "1061446-0",
  "kind": "prh",
  "label": "Euroclear Nordics Ab",
  "type": "edited"
 },
 {
  "changedFields": [
   "lastModified",
   "registeredEntries"
  ],
  "date": "2026-10-30",
  "key": "0981408-6",
  "kind": "prh",
  "label": "Järvi-Suomen Energia Oy",
  "type": "edited"
 }
]
